sentences	sentence_id
"Как разъясняет следователь, ""основная содержательная нагрузка и цель данных экспонатов состоят в том, чтобы транслировать следующие идеи-утверждения: что равноценны и равнозначны (сопоставимы) образы Иисуса Христа и Микки Мауса; что равноценны и равнозначны (сопоставимы) по своему культурному и нравственному содержанию православное христианство и любой медийный продукт, например, мультфильм про Микки Мауса…""."	2009Zapretnoe_iskusstvo_2006.xml_46
"Он пишет дальше: ""Следовательно, работа В. Бахчаняна ""Без названия"" представляет собой и осуществляет предельно циничное, издевательское оскорбление и уничижительное, дисфорическое высмеивание религиозных убеждений и религиозных чувств православных верующих, жестокое унижение их человеческого достоинства по признаку отношения к религии""."	2009Zapretnoe_iskusstvo_2006.xml_54
"Как сказал в одном из интервью ""НГ"" проректор Высшей школы экономики Сергей Рощин, для того, чтобы российской женщине подняться к вершинам власти, ей нужно быть во многом талантливей и умней коллеги-мужчины."	2009Zavaly_Rosobrnadzora.xml_25
"""Да потому что он с нами контракт не стал подписывать"", - объясняет Писеев."	2010Chistka_v_sporte.xml_36
Вряд ли стоит поступать на экономиста с прицелом на бизнес: для этого нужны менеджерские навыки.	2010Ekonomisty.xml_3
"Как заявили ""Деньгам"" в Министерстве образования и науки, ""наиболее существенно сокращается объем бюджетных мест, выделяемых для федеральных органов исполнительной власти, для подведомственных вузов, в которых подготовка экономистов не является профильным направлением деятельности, и эта тенденция сохранится""."	2010Ekonomisty.xml_27
"""Речь идет не о ""стрельбе по площадям"", а об искоренении халтуры и сосредоточении ресурсов в лучших вузах"", - объясняет первый проректор ГУ-ВШЭ Лев Якобсон."	2010Ekonomisty.xml_28
"""Образование не база для карьеры, а база для бэкграунда,""- говорит Андрей Щербак."	2010Ekonomisty.xml_61
"Обращаясь к корреспонденту Forbes, Бекмамбетов, хитро улыбаясь, замечает: ""Я думаю, что люди все-таки больше хотят смотреть кино про себя, чем кино про голубых человечков""."	2010Filmy_Timura_Bekmambetova.xml_10
"Роднянский говорит, что Бекмамбетов был выбран Первым каналом на роль создателя фильма как ""бескомпромиссно коммерческий режиссер, не отравленный никакого рода амбициями и сантиментами авторского кинематографа, но при этом технологически блистательный профессионал""."	2010Filmy_Timura_Bekmambetova.xml_25
"""Была общая картина рынка, и были мы - два разных мира"", - говорит Бекмамбетов."	2010Filmy_Timura_Bekmambetova.xml_38
"""Прибыль была в районе 30%"", - говорит режиссер."	2010Filmy_Timura_Bekmambetova.xml_40
"""Мы становимся жертвами не совсем добросовестной рекламы заменителей грудного молока"", - заявила она, добавив, что материнское молоко является основой формирования иммунитета младенца и что длительное грудное вскармливание рекомендовано Всемирной организацией здравоохранения."	2010Fizkultura_i_okolo.xml_31
"""Наше непримиримое соперничество в прошлом"", - говорил Анатолий Карпов."	2010Karpov-Kasparov.xml_51
"""Чувак, я тебе скажу - это круто"", - описала впечатления шахматистка."	2010Karpov-Kasparov.xml_66
Каспаров никому не дал ни одного шанса.	2010Karpov-Kasparov.xml_67
"""Осталось только видеоповторы, как в катании, ввести: тогда судья не сможет сказать, что, мол, не увидел, выполнил спортсмен элемент или нет"", - считает Новикова."	2010Khudozhestvennaya_gimnastika.xml_42
"""Некоторым медведь на ухо наступил, но это судить им не мешает"", - говорит одна из экс-гимнасток."	2010Khudozhestvennaya_gimnastika.xml_47
- Стиль использования тормозов играет в образовании пробок колоссальную роль: плавное торможение, выполненное водителем, который заметил проблему загодя, позволяет транспортному потоку остаться плавным и непрерывным.	2010Matematika_probok.xml_20
"По мнению Ирины, государство еще не скоро всерьез доберется до рынка, на котором она орудует: ""Если уж с порнографией сделать ничего не могут, то что уж тут говорить о рефератах с курсовыми!"""	2010Mozgi_naprokat.xml_98
"""Теперь мы, пользуясь статистическими и компьютерными методами, будем изучать синтаксис и грамматическую структуру надписей из долины Инда"", - говорит Раджеш Рао."	2010Nadpisi_iz_doliny_Inda.xml_49
"""Просто хотел выглядеть хорошо, с девушками общаться - вот и стал вес сгонять, 32 кг скинул, рельеф появился"", - говорит Зарипов."	2010Paraolimpiitsy.xml_53
"Как он говорит, ""четыре раза стал чемпионом Башкирии среди мужиков""."	2010Paraolimpiitsy.xml_57
"""Говорят, у нас денег на нормальных нет, а вы тут со своими дураками лезете"", - рассказывает Newsweek гендиректор организации Валерий Антонов."	2010Paraolimpiitsy.xml_76
"""Пусть ""Сколково"" с их миллионами занимается экспериментами, а у нас таких возможностей нет"", - говорят некоторые деканы."	2010Rossiiskie_biznes-shkoly.xml_56
"Один из ректоров ""не для записи"" заявил: ""Если исходить из экономической выгоды, то я бы закрыл все программы кроме бакалавриата""."	2010Rossiiskie_biznes-shkoly.xml_81
Дениса тут же хватает в охапку, как плюшевую игрушку, какая-то пышногрудая канадка.	2010Russkii_dom.xml_26
"""Русский дом"" для него привычное выражение - его часто видят в одноименном ресторане в Вашингтоне после матчей Washington Capitals."	2010Russkii_dom.xml_47
Самого Скобрева, правда, задолго до концерта отправили обратно в Олимпийскую деревню - чтобы не перегорел перед новыми стартами.	2010Russkii_dom.xml_55
Через несколько дней Евгений Плющенко выступал последним и должен был брать золотую медаль, но и ему не повезло - судьи отдали первое место американцу Лайсачеку.	2010Russkii_dom.xml_85
Впрочем, страшен не сам по себе дефицит, а неспособность с ним справиться.	2010Spasenie_evro.xml_32
Не кроликов кормить, так клетки ремонтировать.	2011Apraushev.xml_95
"""Траншею копали, разумеется, сами, - говорит Апраушев, - наплевал я на запреты, холода наступали""."	2011Apraushev.xml_116
"Графиня Уварова, многолетний председатель Московского археологического общества, говорила: ""Археология - наука людей богатых""."	2011Gde_zhe_Shliman.xml_5
"""Мой волшебный Петербург"", - писал он."	2011Gde_zhe_Shliman.xml_20
"Когда-то, на заре перестройки, Михаил Шемякин поразил меня фразой, которой так охарактеризовал родной ""совок"": ""Мы выросли в кефире""."	2011Grisha_Perelman_devyatyi_genii.xml_24
И на фоне развернутой метафоры вершины - научного или физического достижения - мне был интересен путь человека, состоящего не просто из науки, а науки, совершенно недоступной социуму.	2011Grisha_Perelman_devyatyi_genii.xml_104
А по темному тоннелю бежать почти невозможно, теряешь ориентацию.	2011Mariam_Petrosyan.xml_29
Не тяжело переходить с одного языка на другой?	2011Mariam_Petrosyan.xml_130
"""Я лично убежден, что мы, физики, могли бы решать такие задачи просто ради интереса или забавы"", - сказал Ричард Фейнман."	2011Nano.xml_85
Ежегодно многие люди совершают свой первый полет на планере.	2011Planerizm.xml_43
Полеты на расстояние разрешаются, если они имеют достаточный опыт, чтобы находить источники подъема вдали от домашнего аэродрома, летать и приземляться в незнакомых местах при необходимости.	2011Planerizm.xml_143
Так вот обычно в лазере усиливается не одна конкретная длина волны, а несколько близких или даже много близких длин волн.	2011Sverkhkorotkoe_vremya.xml_199
"В его ""коллекции"" - видео того, как на Поклонную гору организованно выдвигается на автобусе группа поддержки Путина из подмосковного Дзержинска, а также некоторые ""показательные"" интервью с участниками акции, которые вызывают у недовольных откровенную насмешку."	2012Itogi_subboty.xml_36
Что у меня получилось?	2012Ne_mogu_bolshe_molchat.xml_52
"Та скажет: ""Иди, доча, благословляю""."	2012Poslednie_russkie.xml_95
"Мои хорошие, тетка моя говорила:""Если бы дети так заботились о родителях, как родители о детях, - конца света никогда бы не было""."	2012Poslednie_russkie.xml_113
На неудачную шутку скажут: иди в овин, да шути там один.	2012Poslednie_russkie.xml_217
Но базовая вещь - должна быть единая либеральная партия.	2012Putin_vzyal_kurs_na_agressivnoe_uderzhanie_status-kvo.xml_35
Причем, это не просто редакционная правка, это совершенно осознанное положение.	2012Putin_vzyal_kurs_na_agressivnoe_uderzhanie_status-kvo.xml_132
А физическое вытеснение 10-15 тысяч человек - это уже войсковая операция в центре Москвы.	2012Putin_vzyal_kurs_na_agressivnoe_uderzhanie_status-kvo.xml_172
13 апреля 1943 года германское радио сообщило о массовом захоронении в Катынском лесу расстрелянных польских офицеров.	2013Katyn.xml_1
"Он прямо указывает на ""отсутствие механизма ответственности в системе государственной власти, следствием чего становятся коррупция и некомпетентность, доминирование частных и корпоративных интересов при подготовке многих важных решений""."	2013Minfin_protiv_Glazieva.xml_6
И поэтому многие бывают шокированы, узнав, что научные теории никогда не доказываются, никогда не опровергаются и вполне могут находиться в противоречии друг с другом и с экспериментом.	2013Nauka.xml_24
"Вспомните Гека Финна, говорившего: ""Я не позволю, чтобы хождение в школу помешало моему образованию""."	2013Plody_alternativnogo_prosveshcheniya.xml_188
"После декабря-мая и событий вокруг ""Pussy Riot"" мы как раз имеем дело с таким ""извлечением"": из религиозной и моральной области."	2013Podarok_dlya_vsekh.xml_35
Что, о ужас, у сторонников европейского выбора появились самые настоящие враги в политическом смысле.	2013Podarok_dlya_vsekh.xml_111
Если все будет как обычно, то первый месяц будем спорить о том, нужно ли участвовать в выборах или бойкотировать их.	2013Putin_idet_na_ty.xml_36
Это гораздо более сложная картина действительности.	2013Rossiya_na_evropeiskom_fone.xml_171
Советские бойцы отразили и этот удар.	2013Stalingrad.xml_149
Новая тактика: война в руинах.	2013Stalingrad.xml_183
Чтобы создать или сохранить мощное государство.	2013Uchebnik_istorii.xml_37
"""Сегодня все больше и больше неангажированных российских ученых приходят к выводу, что в советский период отечественной истории в СССР были заложены основы принципиально новой цивилизационной системы"" - пишет Анатолий Шендрик."	2014Chto_budet_posle.xml_47
"Он пишет, что социализм - это ""общественный строй, в котором отсутствуют все формы эксплуатации и угнетения, которому присуща высокая экономическая эффективность, соревнование всех форм собственности на средства производства, народовластие, материальное благополучие, свобода, всестороннее духовное развитие человека""."	2014Chto_budet_posle.xml_58
"Например, Александр Бузгалин пишет, что мы стоим на пороге ""новой Касталии"", мира творцов."	2014Chto_budet_posle.xml_225
Во всяком случае, сетевые структуры демонстрируют, как именно возможна экономика без найма.	2014Chto_budet_posle.xml_309
"То он заявляет, почти буквально повторяя Ленина: ""Я действительно считаю кино ключевым, важнейшим направлением работы министерства""."	2014Kulturnye_olimpiitsy.xml_110
Ее жилая комната находилась там же.	2014Na_dvukh_voinakh_1.xml_23
Но был в селе мужик, у которого излечение кликуш, как говорили, получается лучше, чем у батюшки.	2014Na_dvukh_voinakh_1.xml_233
Все стены зала увешаны охотничьим оружием и трофеями многочисленных охот.	2014Na_dvukh_voinakh_1.xml_295
"Он сказал: ""Я с вами, Ваше Величество, встречаюсь второй раз""."	2014Na_dvukh_voinakh_1.xml_351
"Государь улыбнулся и сказал: ""Помню-помню""."	2014Na_dvukh_voinakh_1.xml_354
"И если кто-нибудь спрашивал меня, кто это, я отвечал: ""Это моя невеста""."	2014Na_dvukh_voinakh_1.xml_392
Например, в Англии существовала практика, при которой вдовая королева могла выходить замуж только за равного ей по происхождению и социальному статусу.	2014Travin-1.xml_135
Были те, которые хотя бы внешне напоминали Англию по образу жизни широких масс населения.	2014Travin-2.xml_47
Либо ты осуществляешь преобразования, либо лишаешься своих земель, городов, подданных и тех ресурсов, которые можно из всего этого извлекать.	2014Travin-2.xml_122
"Вручая ее, они мне сказали: ""Ленечка, храни эту книгу, в ней весь Белинский""."	2014Vspolokhi-1.xml_122
"Народная артистка СССР Быстрицкая тогда мне сказала: ""Леонид Ефимович, что вы наделали, посмотрите сюда""."	2014Vspolokhi-1.xml_130
"Я - школьник - все же сказал: ""Он не виноват, что остался жив"", но морду запомнил и возненавидел."	2014Vspolokhi-1.xml_252
Главным своим делом по-прежнему считаю всемерное содействие продвижению демократических реформ в России теперь уже в новом своем качестве, утверждению в мире нового мышления.	2015Gorbachov.xml_141
"""Поздравляю, Коля, это к тебе"", - сказал дядя Вася."	2015iz_predanii.xml_62
"Примерно в это же время к бабушке, все еще сидевшей на ступеньках лестницы, сверху спустился все тот же щеголь в кожанке и пенсне и сказал ей: ""Мадам, ваш супруг будет скоро освобожден""."	2015iz_predanii.xml_172
"Вернувшись в кабинет, дед сказал Дзержинскому: ""Ехать невозможно""."	2015iz_predanii.xml_197
"""Как будет вам угодно, ваше превосходительство"", - с поклоном сказал швейцар и пошел за ключами."	2015iz_predanii.xml_210
"""Это могущественный, ответственный, молодой, энергичный, ориентированный на будущее человек"", - сказал Шваб."	newsYa_01.xml_22
"""Да, это заболевание может быть спровоцировано длительной неподвижностью человека"", заявила пресс-атташе компании ""British Airways""."	newsYa_02.xml_10
"Этот шаг предполагает отмену запретов на поставки технологий, реструктуризацию пакистанского долга, а также дает ""зеленый свет"" для новых займов."	newsYa_03.xml_49
"""Я хотел бы остаться в Каталонии еще по меньшей мере на два года"", - заявил голландец."	newsYa_13.xml_29
Этому в немалой степени способствовала довольно сдержанная реакция на решение Норвегии со стороны Организации стран экспортеров нефти, которая так и не дала однозначного ответа на вопрос о том, пойдет ли ОПЕК на обещанное сокращение с января будущего года ежедневной добычи нефти на 1,5 млн баррелей.	newsYa_16.xml_46
В подарок Деду Морозу столичный мэр преподнес валенки.	newsYa_18.xml_25
В Пакистане проводятся массовые аресты лидеров и активистов экстремистских мусульманских группировок.	newsYa_21.xml_15
При прохождении автомашины УАЗ и БТР с сотрудниками ОМОНа, следовавшими для смены нарядов по охране здания министерства внутренних дел, по проспекту Акушинского на обочине дороги сработало неустановленное взрывное устройство, начиненное гвоздями и обрезками металлических пластин.	newsYa_23.xml_44
"""Пауэлл сказал Арафату, что свидетельства участия палестинской администрации в этом инциденте слишком серьезны"", - сообщил представитель госдепартамента США Ричард Баучер (Richard Boucher)."	newsYa_25.xml_50
По его словам, это произошло рано утром в воскресенье в центральной провинции Куангнгай.	newsYa_48.xml_45
132 человека, в том числе члены съемочной группы Сергея Бодрова, по-прежнему остаются пропавшими без вести.	newsYa_72.xml_90
А Владимир Соколин заверил регионы в готовности Министерства финансов уже в текущем году возместить финансовые затраты субъектов федерации на проведение переписи.	newsYa_74.xml_25
Монахов молчит.	uppsalaBitov_3.xml_206
С этого же времени стала мать приходить домой пьяная - не каждый день, а раза два в неделю.	uppsalaGrekova_2.xml_79
Он ткнулся туда-сюда, как потерявшаяся собака, и пошел наугад.	uppsalaGrekova_2.xml_238
И почему она существовала?	uppsalaGrekova_3.xml_320
Итак, ваша точка зрения как специалиста?	uppsalaKorp_210.xml_166
В сущности, такова она и сегодня, на исходе XX века.	uppsalaKorp_713.xml_17
Взять для примера последние Пленумы ЦК КПСС.	uppsalaKorp_719.xml_18
