sentences	sentence_id
Папа утверждал, что ушло их четыреста, а вернулось четырнадцать.	2015Blokadnoe_detstvo.xml_65
Мы с первого моего лета уезжали в деревню Сорочкино под Лугой.	2015Blokadnoe_detstvo.xml_129
Мама сказала: попробуй повоюй на его месте.	2015Blokadnoe_detstvo.xml_227
Других девочек вокруг еще не появилось: все они поприезжали позже.	2015Blokadnoe_detstvo.xml_549
Эксперты в Киеве отмечают, что именно этот показатель наиболее важен, поскольку он свидетельствует о том, что украинцы опасаются действий России и при этом не доверяют Евросоюзу, на помощь которого ранее надеялись.	2015Donbass.xml_16
Хотя украинские чиновники заявили, что беспорядки были провокацией, организованной российскими спецслужбами, люди, побывавшие в последнее время в Донбассе, не согласны с этим мнением.	2015Donbass.xml_29
Каковы были условия, кто вел переговоры, почему не состоялось - все это уже описано, опубликовано.	2015Glavnaya_taina_nachala_voiny.xml_110
"Отечественная пропаганда объясняет россиянам, что одна из главных причин нынешней ""крымско-украинской"" политики России - это необходимость дать ответ на вызов Запада, на его попытку ущемить жизненно важные российские интересы."	2015Interviyu_Dvorkina.xml_1
У нас действовали до 20 различных групп, комитетов и прочих структур по совместной борьбе с терроризмом, пиратством, по поиску и спасению на море, по ликвидации последствий аварий на ядерных объектах, осуществлялись взаимные посещения военных учений.	2015Interviyu_Dvorkina.xml_72
Он сказал, что все страны должны платить за оборону.	2015Interviyu_Dvorkina.xml_107
Поэтому везде, где только можно, я утверждаю, что ЕвроПРО и глобальная ПРО никоим образом не могут подорвать наш потенциал ядерного сдерживания.	2015Interviyu_Dvorkina.xml_179
- Президент США заявил, что западные санкции порвали экономику России в клочья.	2015Interviyu_Yavlinskogo.xml_5
- В России в 90-е была создана система периферийного капитализма.	2015Interviyu_Yavlinskogo.xml_43
Поскольку минские достижения иллюзорны, утверждает Пастухов (а они действительно иллюзорны в плане разрешения кризиса), необходимо изобрести нечто им взамен.	2015Ne_nado_vozvrashchatsya_k_Yalte.xml_20
Могут разрешить взять капитана с Украины, например, но не рыбообработчиков, которых у нас своих на берегу полно.	2015Nelegalnye_kholodilniki.xml_26
Все, вплоть до мелочей, туда входит: место, наличие экипажа, остаток топлива, сколько рыбы взяли, происшествия.	2015Nelegalnye_kholodilniki.xml_141
"В то же время попытки влиятельных ""Московских ведомостей"" пропагандировать английскую идею свободы торговли не имели успеха, поскольку общественное мнение держалось тут другого взгляда."	2015Opravdanie_televideniya.xml_173
И очень важно, что здесь Генис говорит о людях, склонных к оппонированию российскому правительству, зачастую об эмигрантах.	2015Opravdanie_televideniya.xml_193
Способы были разные.	2015Pervyi_avtomobil.xml_5
Но в СССР Политбюро все-таки знало, что оно - единственный институт преемственности.	2015Poroshenko_dolzhen_pobedit.xml_63
Потому их называли поминальными свечами.	2015Pust_dolgim_budet_razgovor.xml_25
Люди, хорошо помнившие довоенные годы в СССР, в один голос утверждают, что до войны массового бытового антисемитизма почти не было.	2015Pust_dolgim_budet_razgovor.xml_78
В своей пропаганде нацисты постоянно подчеркивали, что сражаются за освобождение русского, украинского и белорусского народов от чужеродной власти коммунистов и евреев.	2015Pust_dolgim_budet_razgovor.xml_88
Расходный материал, завышенная норма потерь на маневрах.	2015Razvorot_nad_Atlantidoi.xml_82
Британские журналисты утверждают, что речь шла о десяти миллионах долларов в год, хотя документального подтверждения никто не нашел.	2015Rezhimnyi_subiekt.xml_25
Там он назвал свою фамилию и, сказав, что ему нужна рабочая сила для завода, заполнил грузовики заключенными.	2015Spiski_Shindlerov.xml_59
"Швейцарский вице-консул в Будапеште, получил от своего правительства 8 тысяч ""защитных паспортов"", в каждый из которых вписывал целую семью."	2015Spiski_Shindlerov.xml_170
Случается, покупатели расплачиваются за покупку банка выведенными из него деньгами.	2015Strakhovanie_vkladov_2.xml_90
"В Европе достаточно сланцевого газа, однако добыча его затруднена из-за европейской бюрократии и активизма ""зеленых"", которых, кстати, часто щедро финансирует Кремль."	2015Velikaya_neftegazovaya.xml_25
"В ""Акын-опере"" ситуация была иная."	2016Migranty_ekspaty_kosmopolity.xml_13
Он говорит, что не знает, что это за машина едет за ним, в его время таких не было, но по конструкции ясно, что не бензин везет.	2016Migranty_ekspaty_kosmopolity.xml_28
Вот моложавая Елена из Джезказгана, она немка по отцовской линии, но в доме по-немецки не говорили, у нее звонкий пионерский характер, она рассказывает, какие у них в городе были проспекты, как она была командиром отряда и мечтала быть космонавтом.	2016Migranty_ekspaty_kosmopolity.xml_31
Елена рассказывает, что у нее очень интересная работа в аэропорту, она отправляет российские и казахские рейсы.	2016Migranty_ekspaty_kosmopolity.xml_37
После спектакля Штефан Кэги рассказывает, что своим учителем считает учителя физики в школе, который умел объяснить то, что, казалось бы, понять невозможно.	2016Migranty_ekspaty_kosmopolity.xml_67
Естественно, сделать это очень сложно, потому что везде свои традиции, языки.	2016Slovo_ne_to_chem_kazhetsya.xml_109
Борис Иомдин.	2016Slovo_ne_to_chem_kazhetsya.xml_313
Вопросы подготовили Михаил Гельфанд и Ирина Левонтина.	2017Apresyan_1.xml_5
"Это была не инициатива масс, а поручение созданной в аппарате ЦК партии ""Группы по делам культурной революции""."	2017Kulturnaya_revolyutsiya.xml_15
Представитель СБУ заявил вечером в среду, что на самом деле специалисты рассматривают шесть версий.	2017Ubiistvo_Pavla_Sheremeta.xml_52
Путин открыто заявил, что структура уполномоченных нуждается в расширении своих процессуальных прав, так что будем надеяться, что защита прав предпринимателей очень скоро обретет новые инструменты.	2018Boris_Titov_i_1000_advokatov.xml_37
Тимофеев-Ресовский верил в Бога и на вопрос, откуда произошел человек, отвечал: это не нашего ума дело!	2018Interviyu_Granina_raznykh_let.xml_124
На самом деле в это время я что-нибудь изобретаю или, склонившись над машинкой, прислушиваюсь к телефону в другой комнате.	2018Nachalo.xml_299
Предложения из послания оформятся в указы после выборов, говорит еще один источник, знакомый с ходом обсуждений.	2018Novye_maiskie_ukazy.xml_6
Когда подписывались майские указы 2012 года, экономика была в лучшей форме, не было санкций, а курс рубля еще не упал, сказал в интервью РБК старший директор группы региональных финансов Fitch Владимир Редькин.	2018Novye_maiskie_ukazy.xml_8
Со ссылкой на данные Росстата издание рассказывает, что в 2017 году в брак вступили почти на 64 тысячи пар больше, чем в 2016-м.	2018Novye_maiskie_ukazy.xml_47
То и дело всплывает информация о том, что чиновники якобы уже решились на эту непопулярную меру и даже определили сроки, когда это произойдет.	2018Pensionnyi_vozrast.xml_4
Так, министр труда Максим Топилин заявил, что для этого пока не пришло время, поскольку в нашей стране не очень высокая средняя продолжительность жизни.	2018Pensionnyi_vozrast.xml_26
- Итак, - говорил он, - отвечай, знаешь ли ты некоего Иуду из Кириафа, и что именно ты говорил ему, если говорил, о кесаре?	2018Pontii_Pilat.xml_256
Я не могу их привлечь за ложь, но могу - за безответственность.	2018Roman_Pak_u_Granina.xml_61
Правительство сейчас заявило о том, что люди с большим стажем смогут выйти на пенсию на два года раньше.	2019Interviyu_Nazarova.xml_40
Говоря о ситуации в мире, он подчеркнул, что речь идет не просто о санкциях и давлении на Россию, которые лишь подтверждают масштабный сбой в мировой политике.	2019Medvedev_ostanetsya_s_partiei.xml_21
Господин Медведев подчеркнул, что Россия не будет заниматься самоизоляцией, как бы нас ни пытались вытеснить на обочину глобальной повестки дня.	2019Medvedev_ostanetsya_s_partiei.xml_22
"Первый заместитель главы администрации президента Сергей Кириенко заявил вчера ""РИА Новости"", что не знает, сильными ли будут изменения в структуре администрации президента."	2019Medvedev_ostanetsya_s_partiei.xml_45
11 апреля оппозиционер и глава Красносельского района Илья Яшин бросил вызов Сергею Собянину, заявив о своих планах участвовать в выборах мэра Москвы осенью 2018 года.	2019Obraztsovyi_oppozitsionnyi_kandidat.xml_2
Ты же только что сказал, что большее число кандидатов повышает шансы на второй тур.	2019Obraztsovyi_oppozitsionnyi_kandidat.xml_49
Если, например, будет выдвинута [глава Гагаринского района Елена] Русакова, это будет сильный претендент.	2019Obraztsovyi_oppozitsionnyi_kandidat.xml_166
Военный комиссар говорит, что я плохо исполнял свои обязанности.	2019Obraztsovyi_oppozitsionnyi_kandidat.xml_222
Я на первом заседании комиссии сказал, что приоритетом в своей работе считаю защиту прав призывников и обеспечение законности.	2019Obraztsovyi_oppozitsionnyi_kandidat.xml_224
- А ты? - пыталась наладить треснувший миропорядок Гаянэ.	2019Podkidysh.xml_375
"Студент Артем, пришедший на панихиду с друзьями, говорит, что такие сообщения тиражируются в различных пабликах, в том числе в самом крупном из них - ""Подслушано-Керчь"", на который подписано 45 тысяч человек."	2019Rasstrel_v_Kerchi.xml_10
Женщина говорит, что отец Владислава часто пил и избивал домочадцев.	2019Rasstrel_v_Kerchi.xml_79
В конце концов Галя взяла мальчика и ушла от него на съемную квартиру, в халупу, - говорит Ирина Моисеевна.	2019Rasstrel_v_Kerchi.xml_80
Готовить, стирать, мыть полы, воспитывать детей - все это, по мнению некоторых радикальных феминисток, преступление и порок, так как свидетельствует о мужчинах-эксплуататорах.	2019Sekta_radikalnogo_feminizma.xml_43
Выборы у вас пройдут, и обратно.	2020_Corpus2_0Gastronomicheskie_khroniki.xml_202
Но однажды она провела несколько дней в гостях у ливийского вождя - Муаммара Каддафи.	2020_Corpus2_0Gastronomicheskie_khroniki.xml_525
Публика была самая разношерстная.	2020_Corpus2_0Iz_zhizni_odnogo_ezha.xml_97
Стихи Басё, Иссы, Бусона и других классиков жанра я лишь бегло просмотрел.	2020_Corpus2_0Iz_zhizni_odnogo_ezha.xml_164
Когда он очнулся после операции, он видел прекрасно и без очков.	2020_Corpus2_0Kakie_nashi_gody_1.xml_10
В каждом номере была ванная комната, именно там Фазиль репетировал свою речь на конференции, проверяя по часам время, выделенное на выступление.	2020_Corpus2_0Kakie_nashi_gody_1.xml_17
Я честно выучила эту поэму, но перед Михаилом Ильичом Роммом она как-то не прошла.	2020_Corpus2_0Kakie_nashi_gody_1.xml_665
- Не боись, Пашок, она ж тебе не на горло намоталась, - подскочил к ассистенту Иван Иваныч.	2020_Corpus2_0Milaya_reptiliya.xml_236
Разумом, в том смысле, в каком мы сами его понимаем, обладаем, из всех миллионов видов населяющих планету животных, только мы - вероятность, вернее невероятность, очевидна с первого взгляда.	2020_Corpus2_0Muraviinyi_kosmos.xml_72
Мне кажется, что такой вывод слишком поспешен (большинству ученых тоже, но из других соображений).	2020_Corpus2_0Muraviinyi_kosmos.xml_87
- Вас ждет сюрприз, - предупредил папа и заперся в детской.	2020_Corpus2_0Papa-yumorist.xml_183
Не дай бог, с ним что случится - цивилизация тут же и кончится, вместе с виртуальным миром, в который все постепенно переселялись, а тут, из-за вирусной изоляции, произошла сингулярность.	2020_Corpus2_0Velikoe_pereselenie.xml_44
Вода из нее протекла на тепловыделяющую сборку, та тоже начала ржаветь, продукты коррозии заблокировали отвод тепла, урановая ячейка перегрелась, и активная зона частично расплавилась с нарушением герметичности корпуса реактора.	2020_Corpus2_0Yarkie_vospominaniya.xml_150
"На К-19 (неофициально же прозванная ""Хиросима"") авария с разрушением активной зоны реактора произошла в первом же походе."	2020_Corpus2_0Yarkie_vospominaniya.xml_162
О важности такого шага, в частности, говорил наш министр иностранных дел Сергей Лавров.	2020_RFFIGryadet_li_apokalipsis.xml_57
Недавно Индия провела испытание такого оружия, о чем публично заявил индийский премьер-министр Нарендра Моди, связав это с вопросом о приобретении Индией статуса космической державы.	2020_RFFIGryadet_li_apokalipsis.xml_98
Идет насыщение высокоточным дальнобойным оружием в неядерном оснащении, что крайне важно для материального обеспечения стратегического неядерного сдерживания.	2020_RFFIGryadet_li_apokalipsis.xml_140
"О такой войне министр обороны Сергей Шойгу в интервью ""МК"" недавно сказал так: неизвестно, какой будет третья мировая война, но можно с уверенностью судить, что она будет последней."	2020_RFFIGryadet_li_apokalipsis.xml_163
Очень хитрая рыба водится в Арафурском море.	2020_RFFIIndoneziya_ot_ada_do_raya.xml_41
Я предупреждала Глеба, что в море всякое случается… но чтоб такое!	2020_RFFIIndoneziya_ot_ada_do_raya.xml_56
Разумеется, никакого яхтклуба и яхт здесь не было, только рыбацкие лодочки, сделанные из всего, что под руку попало.	2020_RFFIIndoneziya_ot_ada_do_raya.xml_124
Айя-яй… - закивала медсестра и пригласила следовать за ней.	2020_RFFIIndoneziya_ot_ada_do_raya.xml_343
Наступила абсолютная тишина.	2020_RFFIInstrument_yazyka_2.xml_81
Он был настолько удручен, что даже не пытался прикрыться.	2020_RFFIInstrument_yazyka_2.xml_92
Кроме того, в России он скрывался от преследований Саддама Хусейна.	2020_RFFIInstrument_yazyka_2.xml_287
"Его не смутил пункт, скажем, 3, согласно которому ""64 PDF 11 были развернуты по всей сети Интернета и проверена чувствительность к эффекту ""византийского дефекта"""", ведь, как ни крути, это не противоречило пункту 4, констатировавшему, что было ""выполнено 18 попыток с имитируемой рабочей нагрузкой WHOIS и результаты сравнены с имитацией обучающего программного обеспечения""."	2020_RFFIInstrument_yazyka_2.xml_388
Она утверждала, что решение баллотироваться приняла еще осенью.	2020_RFFINyuta_Federmesser.xml_278
В апреле 2016 года Федермессер возглавила Центр паллиативной помощи московского департамента здравоохранения.	2020_RFFINyuta_Federmesser.xml_285
Эта тенденция, говорят эксперты, сохранится и в ближайшей перспективе.	2020_RFFIOgnev.xml_25
"Президент Путин осенью заявил, что ""пик кризиса в целом достигнут, и российская экономика приспособилась или уверенно приспосабливается к изменяющимся условиям жизни""."	2020_RFFIOgnev.xml_84
Владимир Путин говорил в Госдуме, будто стране это обошлось в 2 трлн рублей, а по расчетам академика Аганбегяна - в 16 трлн.	2020_RFFIOgnev.xml_96
Но в России такой традиции нет.	2020_RFFIOgnev.xml_123
"Не кто иной, как хозяин форума, глава ВТБ Андрей Костин в этом же зале высокомерно заявил: ""Если сегодня малый и средний бизнес не востребован в стране, то какой смысл их кредитовать?""."	2020_RFFIOgnev.xml_136
Напомню, что в свое время Маргарет Тэтчер предупреждала наших деятелей: смените модель экономики - для обслуживания трубопроводов России хватит 50 млн человек.	2020_RFFIOgnev.xml_190
И нынешний цикл короче не будет, говорят эксперты.	2020_RFFIOgnev.xml_272
"Вот и первый вице-премьер Шувалов недавно признал: у правительства нет ""реальных рычагов влияния на банковский менеджмент""."	2020_RFFIOgnev.xml_484
Между тем, утверждает крупный экономист Александр Аузан, декан экономфака МГУ, свои деньги на развитие в России есть.	2020_RFFIOgnev.xml_539
"Политолог Бруно Гроппо объясняет неприятие свободы ""травматическим опытом"" (завоевания, бунты, диктатура), закрепившимся в коллективной генетической памяти народа в качестве доминантных стереотипов."	2020_RFFITrudnosti_ponimaniya.xml_113
"""В результате последних событий ""Союз правых сил"" прекратил свое существование как оппозиционная демократическая партия"", - говорится в обращении Немцова и Милова."	2009Za_pravoe_delo.xml_7
"""Обычно мы так не делаем, но здесь, вы же понимаете, дело политическое"", - сказал ему следователь."	2009Zapretnoe_iskusstvo_2006.xml_4
